{
  "overlayVersion": "0.3.0",
  "datasetVersion": "0.3.0",
  "reviewedOn": "2026-07-14",
  "status": "review-overlay",
  "compatibility": {
    "calculatorInput": false,
    "websiteInput": false,
    "releaseArtifact": false
  },
  "records": [
    {
      "sourceId": "epoch-chatgpt-energy",
      "citation": {
        "title": "How much energy does ChatGPT use?",
        "authors": [
          "Josh You"
        ],
        "organization": "Epoch AI",
        "publishedDate": "2025-02-07",
        "url": "https://epoch.ai/gradient-updates/how-much-energy-does-chatgpt-use"
      },
      "evidenceType": "modeled-estimate",
      "reviewStatus": "reviewed-with-limitations",
      "preciseLocators": [
        {
          "locator": "Opening summary and Estimating the energy cost of a query",
          "relevance": "Reports the roughly 0.3 Wh estimate for a typical GPT-4o text query and states the assumed 500-token output."
        },
        {
          "locator": "Appendix, Energy cost of a typical query",
          "relevance": "Shows the model-size, H100, utilization, batching, and power assumptions behind the estimate."
        }
      ],
      "measurementBoundary": "Modeled inference electricity for one GPT-4o query, including estimated server and data-center overhead per GPU; it does not add end-user device energy or directly measure OpenAI production infrastructure.",
      "workloadAndHardware": "Reference workload is a typical text query with about 500 output tokens. Hardware is modeled as NVIDIA H100 infrastructure with assumed active parameters, throughput, utilization, batching, and power draw.",
      "geography": "Not location-specific; the energy estimate is not tied to a disclosed production data center or grid region.",
      "derivation": "The calculator carries the source's approximately 0.3 Wh typical-query estimate directly into the AI text-prompt energy row. The row's water values are not established by this source.",
      "limitations": [
        "This is transparent expert modeling, not a direct provider measurement.",
        "The result is sensitive to undisclosed model size, token count, batching, utilization, and hardware assumptions.",
        "The workload represents an early-2025 GPT-4o-style query and should not be generalized to reasoning, agentic, image, voice, or long-context workloads."
      ]
    },
    {
      "sourceId": "jegham-how-hungry-is-ai",
      "citation": {
        "title": "How Hungry is AI? Benchmarking Energy, Water, and Carbon Footprint of LLM Inference",
        "authors": [
          "Nidhal Jegham",
          "Marwan Abdelatti",
          "Chan Young Koh",
          "Lassad Elmoubarki",
          "Abdeltawab Hendawi"
        ],
        "organization": "arXiv",
        "publishedDate": "2025-05-14",
        "lastUpdatedDate": "2025-11-24",
        "url": "https://arxiv.org/abs/2505.09598v6"
      },
      "evidenceType": "mixed-method",
      "reviewStatus": "reviewed-with-limitations",
      "preciseLocators": [
        {
          "locator": "Abstract and methodology overview",
          "relevance": "Defines the infrastructure-aware framework as a combination of public API performance, company environmental multipliers, and statistically inferred hardware."
        },
        {
          "locator": "Version 6, Section 7, Figure 6, PDF page 11",
          "relevance": "Reports 33.8 Wh for the GPT-5 long, high-reasoning workload used to contextualize the calculator's reasoning row."
        }
      ],
      "measurementBoundary": "Model-level inference estimates combine observed API behavior with inferred hardware and provider-level energy, water, and carbon multipliers. The results are not direct full-stack measurements from every model provider.",
      "workloadAndHardware": "Thirty commercial models are evaluated across short and long prompt classes. Hardware configurations are statistically inferred where providers do not disclose them.",
      "geography": "Provider and company environmental multipliers are used, but the estimate for an individual request is not tied to the exact facility and time serving that request.",
      "derivation": "Version 6 reports 33.8 Wh for GPT-5 on its long, high-reasoning workload. The calculator preserves that selected benchmark as an intentional upper-end teaching row, not a universal reasoning-prompt average, and then applies its own water bridge to the energy value.",
      "limitations": [
        "The paper combines empirical API observations with inferred infrastructure rather than measuring all provider hardware directly.",
        "Results vary sharply by model, prompt length, output length, and reasoning workload.",
        "The 33.8 Wh result was added in a later revision and does not appear in the original version submitted on 2025-05-14; reproducibility requires the pinned v6 citation.",
        "The calculator's 33.8 Wh selection and water conversion are project synthesis choices that must be reviewed separately from the paper's benchmark tables.",
        "The legacy source record omits Chan Young Koh and misspells Marwan Abdelatti; this overlay supplies the corrected current citation without changing the immutable v0.1.0 release."
      ]
    },
    {
      "sourceId": "scenario-methods",
      "citation": {
        "title": "Digital inventory calculator and scenario method",
        "authors": [
          "Joel Gladd"
        ],
        "organization": "Your Digital Life",
        "publishedDate": "2026-03-07",
        "url": "https://your-digital-life.org/sources-and-method/"
      },
      "evidenceType": "internal-method",
      "reviewStatus": "internal-method",
      "preciseLocators": [
        {
          "locator": "data/methods/boundary-rules.json",
          "relevance": "Defines the calculator's cloud-side versus total-system bridge."
        },
        {
          "locator": "data/methods/water-method.json",
          "relevance": "Defines prompt-specific exceptions and the internal rounded water conversion."
        },
        {
          "locator": "data/methods/zoom-host-method.json",
          "relevance": "Shows the component breakdown and final additions for the hosted Zoom row; it does not document the underlying formulas for each component coefficient."
        }
      ],
      "measurementBoundary": "Project-created synthesis connecting heterogeneous published estimates to the calculator's legacy row-specific cloud/server, network, device, direct-water, and total-water fields.",
      "workloadAndHardware": "Workloads and device assumptions differ by calculator row and are recorded in each activity, device profile, and method record.",
      "geography": "No single geography; the method combines global, U.S., provider-specific, and non-location-specific evidence and must preserve those differences visibly.",
      "derivation": "This is the direct source for internal bridge calculations, device add-ons, scenario bundles, the 1 mL/Wh direct-water heuristic, and the 6 mL/Wh broader-water heuristic. It is a method record, not independent evidence for the underlying empirical coefficients.",
      "limitations": [
        "Internal synthesis cannot substitute for primary measurement.",
        "Several rows combine evidence with different system boundaries, dates, workloads, hardware, and geographies.",
        "The 1-to-6 water bridge is a rounded teaching heuristic rather than a location-specific facility calculation."
      ]
    },
    {
      "sourceId": "ifri-ai-dc-energy",
      "citation": {
        "title": "AI, Data Centers and Energy Demand: Reassessing and Exploring the Trends",
        "authors": [
          "Laure de Roucy-Rochegonde",
          "Adrien Buffard"
        ],
        "organization": "French Institute of International Relations (Ifri)",
        "publishedDate": "2025-02",
        "venue": "Ifri Papers",
        "url": "https://www.ifri.org/sites/default/files/2025-02/ifri_buffard-rochegonde_ai_data_centers_energy_2025_2.pdf"
      },
      "evidenceType": "secondary-synthesis",
      "reviewStatus": "needs-primary-source",
      "preciseLocators": [
        {
          "locator": "Figure 6 and accompanying text, PDF pages 21-22",
          "relevance": "States 0.5 Wh for image generation and attributes the figure to Sasha Luccioni et al. (2024)."
        },
        {
          "locator": "Footnotes 17-20 surrounding Figure 6",
          "relevance": "Provides wider energy-demand context but not a reproducible derivation of the historical pre-v0.2 calculator coefficient of 0.48 Wh."
        }
      ],
      "measurementBoundary": "Policy-report synthesis of AI task-level and data-center energy estimates; the image figure is a secondary citation rather than a measurement conducted by Ifri.",
      "workloadAndHardware": "The figure labels an image-generation task but does not, in the cited passage, specify the model, image dimensions, number of inference steps, hardware, utilization, or data-center overhead needed to reproduce it.",
      "geography": "The task-level image estimate is not tied to a specific facility or grid region; the report's broader scope is international.",
      "derivation": "The report supports only the rough magnitude of the historical pre-v0.2 image row by stating 0.5 Wh per generated image. It does not document the exact former 0.48 Wh coefficient or the calculator's water conversion and is not the source of the current 1.7 Wh value.",
      "limitations": [
        "The historical pre-v0.2 coefficient required a primary benchmark; v0.2.0 replaces it with the IEA benchmark.",
        "The report's nearby 0.0005 Wh ChatGPT text-demand statement is inconsistent with stronger contemporary prompt estimates and should not be imported into the calculator.",
        "The workload and hardware boundary for the image figure is underspecified."
      ]
    },
    {
      "sourceId": "simon-couch-coding-agent",
      "citation": {